{"$schema":"https://json-schema.org/draft/2020-12/schema","$id":"https://aitranslatenovel9527.local/schemas/document-json.schema.json","title":"Web Package document.json","type":"object","additionalProperties":false,"required":["schemaVersion","title","blocks"],"properties":{"schemaVersion":{"const":1},"title":{"type":"string","minLength":1,"maxLength":100},"language":{"type":"string","maxLength":40},"sourceUrl":{"type":"string","format":"uri","maxLength":4096},"blocks":{"type":"array","minItems":1,"maxItems":5000,"items":{"oneOf":[{"type":"object","additionalProperties":false,"required":["id","kind","tag","text"],"properties":{"id":{"type":"string","minLength":1,"maxLength":80},"kind":{"const":"text"},"tag":{"enum":["p","h1","h2","h3","blockquote","li"]},"text":{"type":"string","maxLength":200000}}},{"type":"object","additionalProperties":false,"required":["id","kind","assetPath"],"properties":{"id":{"type":"string","minLength":1,"maxLength":80},"kind":{"const":"image"},"assetPath":{"type":"string","pattern":"^assets/[A-Za-z0-9._-]+\\.(png|jpg|jpeg|gif|webp|svg)$"},"previewAssetPath":{"type":"string","pattern":"^assets/[A-Za-z0-9._-]+\\.png$"},"alt":{"type":"string","maxLength":200},"width":{"type":"integer","minimum":1,"maximum":4000},"height":{"type":"integer","minimum":1,"maximum":4000}},"allOf":[{"if":{"properties":{"assetPath":{"pattern":"\\.svg$"}}},"then":{"required":["previewAssetPath"]},"else":{"not":{"required":["previewAssetPath"]}}}]}]}},"metadata":{"type":"object"}}}
